{
  "$schema": "https://codevachon.github.io/motte/schema/config.json",
  "name": "motte",
  "issuesDir": ".motte/issues",
  "defaultState": "Todo",
  "states": [
    { "name": "Todo", "category": "unstarted" },
    { "name": "In Progress", "category": "started" },
    { "name": "Blocked", "category": "started" },
    { "name": "Done", "category": "completed" },
    { "name": "Cancelled", "category": "cancelled" }
  ]
}
